{
  "$comment": "Generated by `gwylio schema` from the Pydantic models registered in backend/src/gwylio/infrastructure/config/schemas.py. Do not edit by hand.",
  "$defs": {
    "PeriodModel": {
      "additionalProperties": false,
      "description": "The dates a product covers, inclusive, and its label.",
      "properties": {
        "end": {
          "description": "A date, YYYY-MM-DD.",
          "pattern": "^[0-9]{4}-[0-9]{2}-[0-9]{2}$",
          "title": "End",
          "type": "string"
        },
        "label": {
          "description": "YYYY-MM for a month, YYYY for a year.",
          "maxLength": 80,
          "pattern": "^[a-z0-9]+(?:-[a-z0-9]+)*$",
          "title": "Label",
          "type": "string"
        },
        "start": {
          "description": "A date, YYYY-MM-DD.",
          "pattern": "^[0-9]{4}-[0-9]{2}-[0-9]{2}$",
          "title": "Start",
          "type": "string"
        }
      },
      "required": [
        "start",
        "end",
        "label"
      ],
      "title": "PeriodModel",
      "type": "object"
    },
    "ProductLevel": {
      "description": "The level a product serves: the annual picture, the monthly summary, or an alert.",
      "enum": [
        "strategic",
        "operational",
        "tactical"
      ],
      "title": "ProductLevel",
      "type": "string"
    }
  },
  "$id": "snapshot-product-summary.schema.json",
  "$schema": "https://json-schema.org/draft/2020-12/schema",
  "additionalProperties": false,
  "description": "One entry of products.json, GET /api/v1/products.",
  "properties": {
    "generated_on": {
      "description": "YYYY-MM-DD.",
      "pattern": "^[0-9]{4}-[0-9]{2}-[0-9]{2}$",
      "title": "Generated On",
      "type": "string"
    },
    "id": {
      "title": "Id",
      "type": "string"
    },
    "level": {
      "$ref": "#/$defs/ProductLevel"
    },
    "markdown_file": {
      "title": "Markdown File",
      "type": "string"
    },
    "period": {
      "$ref": "#/$defs/PeriodModel"
    },
    "report_count": {
      "title": "Report Count",
      "type": "integer"
    },
    "requirement_set_id": {
      "title": "Requirement Set Id",
      "type": "string"
    },
    "section_headings": {
      "items": {
        "type": "string"
      },
      "title": "Section Headings",
      "type": "array"
    },
    "title": {
      "title": "Title",
      "type": "string"
    }
  },
  "required": [
    "id",
    "level",
    "requirement_set_id",
    "period",
    "generated_on",
    "title",
    "report_count",
    "section_headings",
    "markdown_file"
  ],
  "title": "ProductSummary",
  "type": "object"
}
